{
  "environment": "gemini",
  "runtime_profile": "chat-runtime",
  "capabilities": ["text_generation", "code_synthesis", "analysis"],
  "allowed_actions": ["read_repo", "propose_patch", "update_docs"],
  "memory_map": "environments/gemini/manifests/memory-map.json",
  "risk_level": "medium",
  "execution_scope": "governed-repo-operations"
}
